{
  "$schema": "../../contracts/skill.schema.json",
  "id": "nino-data.analysis",
  "version": "1.0.0",
  "instructions": "SKILL.md",
  "capabilities": ["order-query", "grouped-statistics", "anomaly-analysis", "report-interpretation"],
  "risk_level": "read-only",
  "loop": {
    "max_actions": 6,
    "timeout_seconds": 60,
    "max_consecutive_failures": 2,
    "max_no_progress_steps": 2
  },
  "intent_keywords": [
    "订单",
    "支付",
    "退款",
    "收入",
    "成本",
    "毛利",
    "亏损",
    "统计",
    "报表",
    "order",
    "payment",
    "refund",
    "margin",
    "nino data"
  ],
  "allowed_tools": [
    "nino_data_get_order_detail",
    "nino_data_query_summary",
    "nino_data_find_anomalies"
  ],
  "references": [
    {
      "id": "metric-definitions",
      "path": "references/metric-definitions.md",
      "description": "Authoritative formulas, date-range semantics, currency, and metric limitations."
    },
    {
      "id": "order-query-rules",
      "path": "references/order-query-rules.md",
      "description": "Order detail interpretation and evidence requirements."
    },
    {
      "id": "anomaly-rules",
      "path": "references/anomaly-rules.md",
      "description": "Negative-margin and mismatch reason-code rules."
    },
    {
      "id": "report-output-spec",
      "path": "references/report-output-spec.md",
      "description": "Required report structure and presentation rules."
    }
  ],
  "max_steps": 5,
  "is_default": false
}
